{
  "$schema": "../template.schema.json",
  "id": "fast-patch",
  "version": 1,
  "name": "Fast Patch",
  "description": "Bounded serial delivery by default, with Standard Build available when needed.",
  "recommended": false,
  "pack": {
    "id": "factoru-default",
    "lock": "../../packs/factoru-default/packs.lock"
  },
  "factory": {
    "maxParallelImplementationWorkers": 1
  },
  "team": {
    "project_manager": {
      "modelSlots": ["chat", "planning"],
      "defaultFormula": "queue-reconcile",
      "memoryPolicy": "provenance_required"
    },
    "software_engineer": {
      "modelSlots": ["design", "implementation", "review"],
      "defaultFormula": "software-delivery",
      "memoryPolicy": "provenance_required"
    }
  },
  "workflowPresets": {
    "standard-build": {
      "formula": "standard-build",
      "formulaVersion": "1",
      "launchMode": "attached",
      "variables": {
        "interaction_mode": "autonomous",
        "review_mode": "agent",
        "drain_policy": "same-session",
        "max_iterations": 6,
        "push": false,
        "open_pr": false
      },
      "maxImplementationUnits": 20,
      "maxVerificationAttempts": 2,
      "maxCorrectionAttempts": 6
    },
    "fast-patch": {
      "formula": "software-delivery",
      "formulaVersion": "2",
      "launchMode": "standalone",
      "variables": {},
      "maxImplementationUnits": 1,
      "maxVerificationAttempts": 2,
      "maxCorrectionAttempts": 2
    }
  },
  "allowedWorkflowPresetIds": ["fast-patch", "standard-build"],
  "defaultWorkflowPresetId": "fast-patch"
}
